{
  "specversion": "1.0",
  "id": "00000000-0000-0000-0000-000000000008",
  "source": "//agesoa/delivery",
  "type": "agesoa.audit_report.created",
  "subject": "K-2026-0007",
  "time": "2026-10-14T03:15:00Z",
  "datacontenttype": "application/json",
  "dataschema": "urn:agesoa:schema:event:audit_report.created:v1",
  "data": {
    "audit_report_id": "A-2026-0003",
    "case_id": "K-2026-0007",
    "domain": "mbg",
    "summary": "3 poisoning incidents from one kitchen in 10 days.",
    "root_causes": [
      {
        "statement": "One kitchen serves 34 schools; cook-to-meal gap is 6-7 hours.",
        "status": "supported",
        "evidence_refs": [
          "E-12",
          "E-15"
        ]
      }
    ],
    "recommendations": [
      "Cap schools per kitchen",
      "Move cooking time closer to meal time"
    ],
    "region": {
      "regency_code": null,
      "regency_name": "Kabupaten Sukamaju (fictional)",
      "district_code": null,
      "district_name": "Kecamatan Cibening (fictional)"
    },
    "created_at": "2026-10-14T03:15:00Z",
    "synthetic": true
  }
}
