{
  "specversion": "1.0",
  "id": "00000000-0000-0000-0000-000000000007",
  "source": "//agesoa/trust",
  "type": "agesoa.validator.diaktifkan",
  "subject": "V-0001",
  "time": "2026-10-14T03:15:00Z",
  "datacontenttype": "application/json",
  "dataschema": "urn:agesoa:schema:event:validator.diaktifkan:v1",
  "data": {
    "validator_ref": "V-0001",
    "role": "journalist",
    "field": "public health",
    "region": {
      "regency_code": null,
      "regency_name": "Kabupaten Sukamaju (fictional)",
      "district_code": null,
      "district_name": "Kecamatan Cibening (fictional)"
    },
    "organization_id": "O-0001",
    "tier": "high",
    "status": "probation",
    "activated_at": "2026-10-14T03:15:00Z",
    "synthetic": true
  }
}
