{
  "specversion": "1.0",
  "id": "00000000-0000-0000-0000-000000000002",
  "source": "//agesoa/ingestion",
  "type": "agesoa.signal.received",
  "subject": "S-2026-0042",
  "time": "2026-10-14T03:15:00Z",
  "datacontenttype": "application/json",
  "dataschema": "urn:agesoa:schema:event:signal.received:v1",
  "data": {
    "signal_id": "S-2026-0042",
    "domain": "mbg",
    "category": "poisoning",
    "occurred_on": "2026-09-30",
    "region": {
      "regency_code": null,
      "regency_name": "Kabupaten Contoh",
      "district_code": null,
      "district_name": null
    },
    "summary": "Dozens of pupils treated after a free school meal.",
    "sources": [
      {
        "url": "https://news.example.org/2026/09/30/mbg",
        "publisher": "news.example.org",
        "kind": "news",
        "published_at": "2026-09-30T08:00:00Z"
      }
    ],
    "dedup_key": "mbg|kabupaten-contoh|2026-09-30",
    "synthetic": true
  }
}
