{
  "specversion": "1.0",
  "id": "00000000-0000-0000-0000-000000000003",
  "source": "//agesoa/case-audit",
  "type": "agesoa.case.updated",
  "subject": "K-2026-0007",
  "time": "2026-10-14T03:15:00Z",
  "datacontenttype": "application/json",
  "dataschema": "urn:agesoa:schema:event:case.updated:v1",
  "data": {
    "case_id": "K-2026-0007",
    "domain": "mbg",
    "category": "poisoning",
    "status": "investigating",
    "evidence_status": "available",
    "evidence_deadline_at": "2026-10-15T22:00:00Z",
    "max_finding_status": "proven",
    "region": {
      "regency_code": null,
      "regency_name": "Kabupaten Sukamaju (fictional)",
      "district_code": null,
      "district_name": "Kecamatan Cibening (fictional)"
    },
    "report_ids": [
      "R-2026-0001"
    ],
    "signal_ids": [],
    "updated_at": "2026-10-14T03:15:00Z",
    "synthetic": true
  }
}
