{
  "specversion": "1.0",
  "id": "00000000-0000-0000-0000-00000000000a",
  "source": "//agesoa/delivery",
  "type": "agesoa.follow_up.updated",
  "subject": "K-2026-0007",
  "time": "2026-10-14T03:15:00Z",
  "datacontenttype": "application/json",
  "dataschema": "urn:agesoa:schema:event:follow_up.updated:v1",
  "data": {
    "case_id": "K-2026-0007",
    "organization_id": "O-0002",
    "status": "in_progress",
    "note": "Kitchen inspection scheduled.",
    "internal_ticket": "SIM-118",
    "updated_at": "2026-10-14T03:15:00Z",
    "synthetic": true
  }
}
