{
  "specversion": "1.0",
  "id": "00000000-0000-0000-0000-00000000000b",
  "source": "//agesoa/delivery",
  "type": "agesoa.right_of_reply.received",
  "subject": "K-2026-0007",
  "time": "2026-10-14T03:15:00Z",
  "datacontenttype": "application/json",
  "dataschema": "urn:agesoa:schema:event:right_of_reply.received:v1",
  "data": {
    "reply_id": "H-0001",
    "case_id": "K-2026-0007",
    "organization_id": "O-0002",
    "body": "The kitchen has been capped at 12 schools since 2026-10-10.",
    "attachments": [],
    "received_at": "2026-10-14T03:15:00Z",
    "synthetic": true
  }
}
